{
  "run_id": "CT-752-20260313-01",
  "from": "nexus",
  "to": "api-docs-agent",
  "state_refs": [
    "shared/runs/CT-752-20260313-01/plan/task-charter.json"
  ],
  "session_refs": [],
  "entity_ids": {},
  "pending_assertions": [],
  "expected_next_step": "Execute API checks/data prep and write result packet + evidence.",
  "recommended_owner": "api-docs-agent",
  "notes": [
    "Pilot dual-write mode is active.",
    "Keep writing legacy evidence path and sync to run folder."
  ]
}
