{
  "run_id": "CT-798-20260318-01",
  "from": "nexus",
  "to": "qa-agent",
  "state_refs": [
    "shared/runs/CT-798-20260318-01/plan/task-charter.json"
  ],
  "session_refs": [],
  "entity_ids": {},
  "pending_assertions": [],
  "expected_next_step": "Execute UI flow and write result packet + evidence.",
  "recommended_owner": "qa-agent",
  "notes": [
    "Pilot dual-write mode is active.",
    "Keep writing legacy evidence path and sync to run folder."
  ]
}
